<?xml version="1.0" encoding="UTF-8"?>
<pfa:PFAReturn xmlns:pfa="urn:pencom:pfa:reporting:v1"
               xmlns:xsi="http://www.w3.org/2001/XMLSchema-instance"
               xsi:schemaLocation="urn:pencom:pfa:reporting:v1 PFA_Return_Schema_v1.0.xsd"
               schemaVersion="1.0">

  <pfa:Header>
    <pfa:PFALicenceNo>PFA/2024/00015</pfa:PFALicenceNo>
    <pfa:PFAName>Sample Pension Fund Administrators Limited</pfa:PFAName>
    <pfa:ReturnType>AUM</pfa:ReturnType>
    <pfa:PFCName>Sample Pension Fund Custodian Limited</pfa:PFCName>
    <pfa:ReportingPeriodStart>2026-03-01</pfa:ReportingPeriodStart>
    <pfa:ReportingPeriodEnd>2026-03-31</pfa:ReportingPeriodEnd>
    <pfa:SubmissionDateTime>2026-04-10T09:00:00Z</pfa:SubmissionDateTime>
    <pfa:ContactPerson>Emeka Okafor</pfa:ContactPerson>
    <pfa:ContactEmail>returns@samplepfa.com.ng</pfa:ContactEmail>
  </pfa:Header>

  <pfa:AssetsUnderManagement>
    <pfa:FundAUM>
      <pfa:FundType>FundI</pfa:FundType>
      <pfa:RSAHolders>15200</pfa:RSAHolders>
      <pfa:AUM>85000.00</pfa:AUM>
      <pfa:NAVPerUnit>5.8742</pfa:NAVPerUnit>
      <pfa:MonthlyGrowthPct>2.15</pfa:MonthlyGrowthPct>
    </pfa:FundAUM>
    <pfa:FundAUM>
      <pfa:FundType>FundII</pfa:FundType>
      <pfa:RSAHolders>485000</pfa:RSAHolders>
      <pfa:AUM>1250000.00</pfa:AUM>
      <pfa:NAVPerUnit>4.9215</pfa:NAVPerUnit>
      <pfa:MonthlyGrowthPct>1.82</pfa:MonthlyGrowthPct>
    </pfa:FundAUM>
    <pfa:FundAUM>
      <pfa:FundType>FundIII</pfa:FundType>
      <pfa:RSAHolders>120000</pfa:RSAHolders>
      <pfa:AUM>380000.00</pfa:AUM>
      <pfa:NAVPerUnit>4.5102</pfa:NAVPerUnit>
      <pfa:MonthlyGrowthPct>1.45</pfa:MonthlyGrowthPct>
    </pfa:FundAUM>
    <pfa:FundAUM>
      <pfa:FundType>FundIV</pfa:FundType>
      <pfa:RSAHolders>42000</pfa:RSAHolders>
      <pfa:AUM>165000.00</pfa:AUM>
      <pfa:NAVPerUnit>3.8500</pfa:NAVPerUnit>
      <pfa:MonthlyGrowthPct>0.95</pfa:MonthlyGrowthPct>
    </pfa:FundAUM>
    <pfa:FundAUM>
      <pfa:FundType>FundV</pfa:FundType>
      <pfa:RSAHolders>8500</pfa:RSAHolders>
      <pfa:AUM>3200.00</pfa:AUM>
      <pfa:NAVPerUnit>2.1050</pfa:NAVPerUnit>
      <pfa:MonthlyGrowthPct>1.60</pfa:MonthlyGrowthPct>
    </pfa:FundAUM>
    <pfa:FundAUM>
      <pfa:FundType>FundVI_Active</pfa:FundType>
      <pfa:RSAHolders>12300</pfa:RSAHolders>
      <pfa:AUM>28000.00</pfa:AUM>
      <pfa:NAVPerUnit>3.4200</pfa:NAVPerUnit>
      <pfa:MonthlyGrowthPct>1.35</pfa:MonthlyGrowthPct>
    </pfa:FundAUM>

    <pfa:TotalRSAHolders>683000</pfa:TotalRSAHolders>
    <pfa:TotalAUM>1911200.00</pfa:TotalAUM>
  </pfa:AssetsUnderManagement>

  <pfa:Signature>
    <pfa:PreparedBy>
      <pfa:Name>Aisha Mohammed</pfa:Name>
      <pfa:Designation>Head, Operations &amp; Reporting</pfa:Designation>
      <pfa:Date>2026-04-08</pfa:Date>
    </pfa:PreparedBy>
    <pfa:CEOSignOff>
      <pfa:Name>Chidi Nwankwo</pfa:Name>
      <pfa:Designation>Managing Director / CEO</pfa:Designation>
      <pfa:Date>2026-04-10</pfa:Date>
    </pfa:CEOSignOff>
    <pfa:CIOSignOff>
      <pfa:Name>Olumide Adeyemi</pfa:Name>
      <pfa:Designation>Chief Investment Officer</pfa:Designation>
      <pfa:Date>2026-04-10</pfa:Date>
    </pfa:CIOSignOff>
    <pfa:CertificationStatement>I/We certify that the information provided is true, accurate, and complete to the best of our knowledge and in compliance with PenCom regulations and the Pension Reform Act 2014.</pfa:CertificationStatement>
  </pfa:Signature>

</pfa:PFAReturn>
